{
  "$schema": "../schema/pets.schema.json",
  "version": 1,
  "packageName": "awesome-codex-pets",
  "repository": "https://github.com/huaqingai/awesome-codex-pets",
  "rawBaseUrl": "https://raw.githubusercontent.com/huaqingai/awesome-codex-pets/main",
  "previewStates": [
    "idle",
    "waving",
    "running",
    "waiting",
    "review"
  ],
  "categories": [
    {
      "id": "mascots",
      "name": "Mascots",
      "description": "Mascot-style pets for tools, teams, and products."
    },
    {
      "id": "anime-characters",
      "name": "Anime Characters",
      "description": "Character-inspired Codex pets."
    },
    {
      "id": "animals",
      "name": "Animals",
      "description": "Animal-inspired Codex pets."
    },
    {
      "id": "original-characters",
      "name": "Original Characters",
      "description": "Original character pets from the community."
    },
    {
      "id": "pixel",
      "name": "Pixel Pets",
      "description": "Pixel-art pets and retro sprites."
    }
  ],
  "pets": [
    {
      "id": "boilbyte--kongsiyu",
      "name": "Boilbyte",
      "description": "A compact ember-orange patch-drake who looks like a pragmatic coding tinkerer, with terminal-green accents and a tiny utility harness.",
      "category": "mascots",
      "tags": [
        "dragon",
        "coding",
        "mascot",
        "ember",
        "terminal"
      ],
      "aliases": [
        "boilbyte"
      ],
      "author": {
        "name": "kongsiyu",
        "url": "https://github.com/kongsiyu"
      },
      "url": "https://github.com/HuaqingAI/awesome-codex-pets/tree/main/pets/boilbyte--kongsiyu"
    },
    {
      "id": "byteneko--huaqingai",
      "name": "ByteNeko",
      "description": "A tech-savvy chibi black cat mascot with blue goggles, headset, golden eyes, and glowing cyber tail lines.",
      "category": "mascots",
      "tags": [
        "cat",
        "chibi",
        "tech",
        "cyber",
        "mascot",
        "headset"
      ],
      "aliases": [
        "byteneko"
      ],
      "author": {
        "name": "HuaqingAI",
        "url": "https://github.com/HuaqingAI"
      },
      "url": "https://github.com/HuaqingAI/awesome-codex-pets/tree/main/pets/byteneko--huaqingai"
    },
    {
      "id": "code-wisp--huaqingai",
      "name": "Code Wisp",
      "description": "A soft white hooded code-spirit Codex pet with cyan neon trim, blue eyes, tiny hands, and a floating ghost tail.",
      "category": "mascots",
      "tags": [
        "code-spirit",
        "mascot",
        "coding",
        "hooded",
        "neon",
        "ghost"
      ],
      "aliases": [
        "code-wisp"
      ],
      "author": {
        "name": "HuaqingAI",
        "url": "https://github.com/HuaqingAI"
      },
      "url": "https://github.com/HuaqingAI/awesome-codex-pets/tree/main/pets/code-wisp--huaqingai"
    },
    {
      "id": "natural-selection--huaqingai",
      "name": "Natural Selection",
      "description": "A Three-Body-inspired miniature starship pet with blue engines, amber bridge lights, and compact work-state animations.",
      "category": "mascots",
      "tags": [
        "spaceship",
        "sci-fi",
        "three-body",
        "starship",
        "mascot",
        "codex"
      ],
      "aliases": [
        "natural-selection"
      ],
      "author": {
        "name": "HuaqingAI",
        "url": "https://github.com/HuaqingAI"
      },
      "url": "https://github.com/HuaqingAI/awesome-codex-pets/tree/main/pets/natural-selection--huaqingai"
    },
    {
      "id": "neon-shell--huaqingai",
      "name": "Neon Shell",
      "description": "A compact black terminal-screen mascot with mint neon eyes, a dark hoodie, status lights, and a cursor-tail.",
      "category": "mascots",
      "tags": [
        "terminal",
        "robot",
        "cyber",
        "neon",
        "mascot",
        "codex"
      ],
      "aliases": [
        "neon-shell"
      ],
      "author": {
        "name": "HuaqingAI",
        "url": "https://github.com/HuaqingAI"
      },
      "url": "https://github.com/HuaqingAI/awesome-codex-pets/tree/main/pets/neon-shell--huaqingai"
    },
    {
      "id": "sophon--huaqingai",
      "name": "Sophon",
      "description": "A Three-Body-inspired sophon pet that idles as a cybernetic proton sphere and shifts into a black-armored warrior for work states.",
      "category": "mascots",
      "tags": [
        "sophon",
        "three-body",
        "sci-fi",
        "proton",
        "warrior",
        "mascot",
        "codex"
      ],
      "aliases": [
        "sophon"
      ],
      "author": {
        "name": "HuaqingAI",
        "url": "https://github.com/HuaqingAI"
      },
      "url": "https://github.com/HuaqingAI/awesome-codex-pets/tree/main/pets/sophon--huaqingai"
    },
    {
      "id": "waterdrop-probe--huaqingai",
      "name": "Waterdrop Probe",
      "description": "A Three-Body-inspired waterdrop probe pet with mirror-black metallic skin, cyan sensor light, and compact probe-state animations.",
      "category": "mascots",
      "tags": [
        "waterdrop",
        "probe",
        "sci-fi",
        "three-body",
        "mascot",
        "codex"
      ],
      "aliases": [
        "waterdrop-probe"
      ],
      "author": {
        "name": "HuaqingAI",
        "url": "https://github.com/HuaqingAI"
      },
      "url": "https://github.com/HuaqingAI/awesome-codex-pets/tree/main/pets/waterdrop-probe--huaqingai"
    },
    {
      "id": "bocchi--lingxiaotian",
      "name": "Bocchi",
      "description": "A compact Codex digital pet inspired by Bocchi from Bocchi the Rock.",
      "category": "anime-characters",
      "tags": [
        "anime",
        "music",
        "guitar",
        "bocchi-the-rock",
        "pink-hair"
      ],
      "aliases": [
        "bocchi"
      ],
      "author": {
        "name": "Lingxiaotian",
        "url": "https://github.com/legeling"
      },
      "url": "https://github.com/huaqingai/awesome-codex-pets/tree/main/pets/bocchi--lingxiaotian"
    },
    {
      "id": "chotu--makriman",
      "name": "Chotu",
      "description": "A cheerful, brave young hero who keeps you company while you work.",
      "category": "anime-characters",
      "tags": [
        "animation",
        "kids",
        "hero",
        "indian-animation",
        "fan-art"
      ],
      "aliases": [
        "chotu"
      ],
      "author": {
        "name": "makriman",
        "url": "https://github.com/makriman"
      },
      "url": "https://github.com/makriman/Chhota-Bheem-pet"
    },
    {
      "id": "dnf-female-ammo--qunboo",
      "name": "女弹药Q",
      "description": "A chibi-style Dungeon Fighter Online Female Mechanic (Ammo) desktop pet, featuring idle breathing and gun-twirl animations.",
      "category": "anime-characters",
      "tags": [
        "dnf",
        "dungeon-fighter",
        "female-ammo",
        "game",
        "chibi"
      ],
      "aliases": [
        "dnf-female-ammo"
      ],
      "author": {
        "name": "QunBoo",
        "url": "https://github.com/QunBoo"
      },
      "url": "https://github.com/huaqingai/awesome-codex-pets/tree/main/pets/dnf-female-ammo--qunboo"
    },
    {
      "id": "firefly--lingxiaotian",
      "name": "Firefly",
      "description": "《崩坏：星穹铁道》流萤变身前的人类形态 Codex 数码宠物，温柔、轻盈、白绿金配色。",
      "category": "anime-characters",
      "tags": [
        "anime",
        "honkai-star-rail",
        "firefly",
        "white-hair",
        "mint-green"
      ],
      "aliases": [
        "firefly"
      ],
      "author": {
        "name": "Lingxiaotian",
        "url": "https://github.com/legeling"
      },
      "url": "https://github.com/huaqingai/awesome-codex-pets/tree/main/pets/firefly--lingxiaotian"
    },
    {
      "id": "frieren--lingxiaotian",
      "name": "Frieren",
      "description": "A compact Codex digital pet inspired by Frieren, a calm elven mage companion.",
      "category": "anime-characters",
      "tags": [
        "anime",
        "elf",
        "mage",
        "fantasy",
        "frieren"
      ],
      "aliases": [
        "frieren"
      ],
      "author": {
        "name": "Lingxiaotian",
        "url": "https://github.com/legeling"
      },
      "url": "https://github.com/huaqingai/awesome-codex-pets/tree/main/pets/frieren--lingxiaotian"
    },
    {
      "id": "mahiro--lingxiaotian",
      "name": "Mahiro",
      "description": "A shy Codex digital pet inspired by Mahiro Oyama from ONIMAI, wearing an oversized off-shoulder summer shirt.",
      "category": "anime-characters",
      "tags": [
        "anime",
        "onimai",
        "mahiro",
        "oyama-mahiro",
        "off-shoulder"
      ],
      "aliases": [
        "mahiro"
      ],
      "author": {
        "name": "Lingxiaotian",
        "url": "https://github.com/legeling"
      },
      "url": "https://github.com/huaqingai/awesome-codex-pets/tree/main/pets/mahiro--lingxiaotian"
    },
    {
      "id": "mikoto--lingxiaotian",
      "name": "Mikoto",
      "description": "A chibi electric schoolgirl Codex pet with coin tricks inspired by Misaka Mikoto.",
      "category": "anime-characters",
      "tags": [
        "anime",
        "electric",
        "schoolgirl",
        "misaka-mikoto"
      ],
      "aliases": [
        "mikoto"
      ],
      "author": {
        "name": "Lingxiaotian",
        "url": "https://github.com/legeling"
      },
      "url": "https://github.com/huaqingai/awesome-codex-pets/tree/main/pets/mikoto--lingxiaotian"
    },
    {
      "id": "miku--lingxiaotian",
      "name": "Miku",
      "description": "A compact Codex digital pet inspired by Hatsune Miku, a bright virtual idol singer.",
      "category": "anime-characters",
      "tags": [
        "anime",
        "virtual-idol",
        "teal-hair",
        "twintails",
        "miku"
      ],
      "aliases": [
        "miku"
      ],
      "author": {
        "name": "Lingxiaotian",